{
  "run_type": "forecast_stream_csv",
  "backend_selected": "river_snarimax",
  "candidate_backends": [
    "river_snarimax"
  ],
  "feature_spec": {
    "mode": "auto",
    "lags": [
      1,
      2,
      3,
      7,
      14,
      21,
      28
    ],
    "lag_points": [],
    "lag_step": null,
    "lag_count": null,
    "rolling_windows": [
      3,
      7,
      14
    ],
    "include_calendar": true,
    "calendar_features": [
      "dayofweek",
      "month",
      "day",
      "dayofyear",
      "is_month_start",
      "is_month_end",
      "ordinal",
      "sin_dayofyear",
      "cos_dayofyear"
    ],
    "include_tsfresh": false,
    "tsfresh_window": 30,
    "tsfresh_features": [],
    "include_exogenous": true,
    "exogenous_cols": []
  },
  "inputs": {
    "name": "daily_min_temperatures",
    "horizon": 14,
    "strategy": "streaming",
    "mode": "streaming",
    "strict_backend": false,
    "allow_backend_substitution": false,
    "source": "C:/Users/wzp07/OneDrive/文档/data library/AgentTSForcasting/agentforecast_v1_8/agentforecast/package_data/public_examples/daily_min_temperatures.csv",
    "date_col": "ds",
    "value_col": "y",
    "series_kind": "price",
    "candidate_backends": [
      "river_snarimax"
    ],
    "csv_path": "C:/Users/wzp07/OneDrive/文档/data library/AgentTSForcasting/agentforecast_v1_8/agentforecast/package_data/public_examples/daily_min_temperatures.csv"
  },
  "summary": {
    "headline": "daily_min_temperatures: river_snarimax won the backend comparison and produced a publishable pack.",
    "latest_observed": 13.0,
    "projected_end": 13.291423694885054,
    "artifact_count": 11,
    "narrative": "Compared 1 backend(s) and routed the series to 'river_snarimax'. Exported CSV, chart, card, markdown, and JSON artifacts.",
    "conformal_method": "residual_heuristic",
    "routing_reason": "explicit_backend_selected"
  },
  "diagnostics": {
    "leaderboard": [
      {
        "backend_id": "river_snarimax",
        "mae": 1.196384,
        "rmse": 1.629438,
        "mape": 9.007428,
        "smape": 8.695757,
        "coverage_80": 1.0,
        "avg_width_80": 23.560135,
        "wnc_80": 0.590586,
        "coverage_90": 1.0,
        "avg_width_90": 30.238816,
        "wnc_90": 0.460147,
        "backtest_horizon": 14
      }
    ],
    "conformal": {
      "enabled": false,
      "requested_method": "auto",
      "method": "residual_heuristic",
      "levels": [
        80,
        90
      ],
      "calibration_window": 200,
      "warmup_min": 40,
      "symmetric": true,
      "horizon_aware": true,
      "effective_horizon_aware": false,
      "calibration_size": 14,
      "native_levels": [],
      "fallback_reason": null,
      "backend_id": "river_snarimax",
      "coverage_backtest": {
        "80": 1.0,
        "90": 1.0
      },
      "mean_interval_width": {
        "80": 23.560135,
        "90": 30.238816
      },
      "width_normalized_coverage": {
        "80": 0.590586,
        "90": 0.460147
      },
      "backend_tags": [
        "streaming",
        "accurate",
        "supports_conformal_residual",
        "supports_conformal_horizon"
      ]
    },
    "conformal_by_backend": {
      "river_snarimax": {
        "enabled": false,
        "requested_method": "auto",
        "method": "residual_heuristic",
        "levels": [
          80,
          90
        ],
        "calibration_window": 200,
        "warmup_min": 40,
        "symmetric": true,
        "horizon_aware": true,
        "effective_horizon_aware": false,
        "calibration_size": 14,
        "native_levels": [],
        "fallback_reason": null,
        "backend_id": "river_snarimax",
        "coverage_backtest": {
          "80": 1.0,
          "90": 1.0
        },
        "mean_interval_width": {
          "80": 23.560135,
          "90": 30.238816
        },
        "width_normalized_coverage": {
          "80": 0.590586,
          "90": 0.460147
        },
        "backend_tags": [
          "streaming",
          "accurate",
          "supports_conformal_residual",
          "supports_conformal_horizon"
        ]
      }
    },
    "resolution": {
      "requested_backend": "river_snarimax",
      "resolved_backend": "river_snarimax",
      "mode": "streaming",
      "strict_backend": false,
      "allow_backend_substitution": false,
      "support_tier": "reviewed",
      "dependency_state": {
        "river": true
      },
      "candidate_backends": [
        "river_snarimax"
      ],
      "routing_reason": "explicit_backend_selected",
      "fallback_reason": null,
      "warnings": []
    },
    "cleanup": {
      "cleanup_applied": true,
      "missing_points_filled": 1,
      "duplicate_timestamps_merged": 0,
      "inferred_frequency": "D",
      "step_seconds": 86400.0,
      "exogenous_cols": [],
      "future_feature_policy": "use_provided_then_carry_last"
    },
    "routing": {
      "profile": "explicit",
      "history_len": 1096,
      "horizon": 14,
      "candidate_backends": [
        "river_snarimax"
      ],
      "missing_backends": [],
      "recommended_extras": [],
      "reason": "explicit_backend_selected"
    },
    "streaming": {
      "backend_family": "streaming",
      "rolling_mae_last_5": 0.9286098664401585,
      "baseline_mae_first_5": 1.9675921330184984,
      "drift_ratio": 0.4719524188255271,
      "drift_alert": false
    }
  },
  "metrics": {
    "backend_id": "river_snarimax",
    "mae": 1.196384,
    "rmse": 1.629438,
    "mape": 9.007428,
    "smape": 8.695757,
    "coverage_80": 1.0,
    "avg_width_80": 23.560135,
    "wnc_80": 0.590586,
    "coverage_90": 1.0,
    "avg_width_90": 30.238816,
    "wnc_90": 0.460147,
    "backtest_horizon": 14.0
  },
  "resolution": {
    "requested_backend": "river_snarimax",
    "resolved_backend": "river_snarimax",
    "mode": "streaming",
    "strict_backend": false,
    "allow_backend_substitution": false,
    "support_tier": "reviewed",
    "dependency_state": {
      "river": true
    },
    "candidate_backends": [
      "river_snarimax"
    ],
    "routing_reason": "explicit_backend_selected",
    "fallback_reason": null,
    "warnings": []
  },
  "artifacts": [
    {
      "kind": "history_csv",
      "path": "data/history.csv",
      "media_type": "text/csv",
      "description": "Normalized history"
    },
    {
      "kind": "forecast_csv",
      "path": "data/forecast.csv",
      "media_type": "text/csv",
      "description": "Winner backend forecast"
    },
    {
      "kind": "leaderboard_csv",
      "path": "data/leaderboard.csv",
      "media_type": "text/csv",
      "description": "Backend comparison leaderboard"
    },
    {
      "kind": "forecast_png",
      "path": "plots/forecast.png",
      "media_type": "image/png",
      "description": "Forecast chart"
    },
    {
      "kind": "forecast_card_png",
      "path": "plots/forecast_card.png",
      "media_type": "image/png",
      "description": "Shareable forecast card"
    },
    {
      "kind": "comparison_png",
      "path": "plots/backend_comparison.png",
      "media_type": "image/png",
      "description": "Backend comparison chart"
    },
    {
      "kind": "leaderboard_card_png",
      "path": "plots/leaderboard_card.png",
      "media_type": "image/png",
      "description": "Leaderboard card"
    },
    {
      "kind": "delta_card_png",
      "path": "plots/winner_vs_runnerup_delta.png",
      "media_type": "image/png",
      "description": "Winner vs runner-up delta card"
    },
    {
      "kind": "summary_markdown",
      "path": "reports/summary.md",
      "media_type": "text/markdown",
      "description": "Human-readable report"
    },
    {
      "kind": "artifact_manifest_json",
      "path": "meta/artifact_manifest.json",
      "media_type": "application/json",
      "description": "Artifact contract and provenance manifest"
    },
    {
      "kind": "metadata_json",
      "path": "meta/metadata.json",
      "media_type": "application/json",
      "description": "Structured compare result"
    },
    {
      "kind": "drift_alert_card_png",
      "path": "plots/drift_alert_card.png",
      "media_type": "image/png",
      "description": "Streaming drift alert card"
    }
  ],
  "warnings": [],
  "used_live_data": false,
  "kind": "agentforecast.run_result",
  "schema_version": "1.2.0",
  "schema_ref": "package://agentforecast/package_data/schemas/run_result.schema.json",
  "artifact_schema_version": "1.0.0",
  "tool_version": "1.9.0"
}